Company,Job Title,Location,Salary,Job Summary,URL,Fit Score,Score Rationale
Juno,"Remote BDR - Campus Partnerships",United States (Remote),"Competitive Base + Performance Bonuses","BDR role building partnerships with graduate schools via multi-channel outreach (Instagram, LinkedIn, DMs) to introduce Juno's student loan solutions. Focus on top-of-funnel lead generation.",https://job-boards.greenhouse.io/juno/jobs/4112349009,45,"Too junior - BDR role is entry-level sales; Joey is SVP level with 10+ years experience. Education sector is also outside his core expertise."
SimplyInsured,"Strategic Partnerships Account Manager",Remote (US),"$110,000 - $150,000 + annual bonus","Director of Strategic Partnerships role reporting directly to CEO. Develop and manage partnerships to drive company growth. Requires 5+ years BD experience, early-stage startup/insurtech preferred. Y-Combinator backed company with Intuit/Square partnerships.",https://job-boards.greenhouse.io/si/jobs/7129153,85,"Excellent match - Insurtech sector aligns with Nationwide background; strategic partnerships focus matches current role; reports to CEO like his current setup; salary competitive."
Defense Unicorns,"BDR - Commercial (SI Partnerships)",United States (Remote),"$120,000 - $150,000","SI Partnerships BDR focused on driving partner-sourced revenue through Systems Integrators. Work with Account Executives and partner teams to expand presence. Requires 6+ years BD/partnerships experience. U.S. Government contractor - citizenship required.",https://job-boards.greenhouse.io/defenseunicorns/jobs/5036942007,78,"Strong match for DoD background - Defense Unicorns aligns perfectly with his Program Manager experience at DoD. 6+ years requirement met. BDR title may be junior but defense sector is ideal fit."
HiveMQ,"Strategic Partner Manager",United Kingdom (Remote),"Not Listed","Strategic Partner Manager driving partner-sourced revenue for Industrial IoT platform. Work with GSIs/ISVs and cloud providers. Execute Tier 1 partner account plans and GTM activities. Requires strong Salesforce and enterprise sales experience.",https://job-boards.greenhouse.io/hivemq/jobs/4748272101,55,"Location mismatch - UK Remote position while Joey is US-based in DC/Lisbon. Industrial IoT sector is outside core expertise. Role responsibilities match but geography is significant barrier."
Human Interest,"Partner Account Manager",New York City (Hybrid),"Not Listed","Engage, build and develop key partner accounts and growth opportunities. Focus on 401(k) fintech platform partnerships. Forward-thinking relationship builder needed.",https://boards.greenhouse.io/humaninterest/jobs/partner-account-manager,68,"Good fintech alignment with JP Morgan/SVB background. NYC hybrid may work with DC base. 401(k)/retirement focus is adjacent to financial services experience. Location flexibility needed."
Datadog,"Partner Sales Manager - UKI",United Kingdom/Ireland,"Not Listed","Build channels and alliances that drive new customer adoption and revenue. Identify and recruit new partners. Focus on UK/Ireland region.",https://boards.greenhouse.io/datadog/jobs/partner-sales-manager-uki,50,"Location mismatch - UK/Ireland position. Strong tech company but geography is barrier. Partner sales focus matches skills but region doesn't align."
Teal Media,"Project Manager (Contract-to-Hire)",Remote,"Not Listed","Help identify opportunities for expanded work with existing clients. Collaborate with Business Development to support long-term partnerships. Contract-to-hire position.",https://boards.greenhouse.io/tealmedia/jobs/project-manager,52,"Contract-to-hire is less stable than Joey's current permanent role. Project management focus differs from strategic partnerships. Media sector is outside core expertise."
Allied Global Marketing,"Assistant - Video Game Partnerships",Los Angeles (Remote US),"Not Listed","Assistant-level role supporting video game partnership initiatives. Entry-level position in entertainment marketing.",https://boards.greenhouse.io/alliedglobalmarketing/jobs/assistant-video-game,35,"Far too junior - Assistant level position. Video game/entertainment sector is completely outside financial services expertise. Not recommended."
