Status,Score,Company,Job_Title,Sector,Location,Salary_USD,Job_Summary,Work_Arrangement,Score_Rationale,URL,URL_Status,Found_On
NEW,97,"J. Goldman & Co., L.P.",Hedge Fund - Equity Research Analyst - TMT (Long/Short),Hedge Fund,"New York, NY","$175,000-$225,000","TMT L/S equity research analyst at hedge fund. Conduct fundamental company and industry research, build financial models, present actionable trade ideas. 4+ years experience preferred, ideally at an Equity L/S hedge fund in technology sector.",In-Office,"Near-perfect fit: TMT L/S equity hedge fund role matching Aaron's software coverage expertise exactly. NYC Midtown location, $175K-$225K base exceeds target. 4+ yrs experience aligns well with ~9 yrs background.",https://www.linkedin.com/jobs/view/4360593281,Verified,LinkedIn
NEW,95,JPMorganChase,Equity Research - SMid Technology Senior Analyst - Vice President,Investment Bank,"New York, NY","$200,000-$285,000","Lead coverage of SMid Technology stocks as industry expert. Engage with institutional investors, build Excel-based models, perform valuations, write research notes. Requires 6+ years senior analyst experience covering Technology.",In-Office,Excellent fit: SMid Technology coverage VP role nearly identical to current role at Citizens JMP. $200K-$285K well above target. NYC on-site. 6+ yrs requirement aligns perfectly. Sell-side but at top-tier firm.,https://www.linkedin.com/jobs/view/4371408804,Verified,LinkedIn
NEW,95,Arootah (Client Role),Investment Analyst - Long/Short Equity (TMT & Consumer),Hedge Fund,"New York, NY","$190,000-$200,000","Hedge fund client role via Arootah: conduct fundamental research within TMT and Consumer sectors, build financial models, develop investment ideas with risk/reward frameworks. 2+ years IB experience required, buyside experience a plus.",In-Office,Ideal fit: TMT & Consumer L/S equity at a hedge fund. $190K-$200K meets target. NYC on-site. Fundamental research and financial modeling align perfectly with Aaron's skills. Direct buy-side transition opportunity.,https://www.linkedin.com/jobs/view/4370381391,Verified,LinkedIn
NEW,92,Two Sigma,Fundamental Equity Research Analyst,Hedge Fund,"New York, NY","$150,000-$225,000",Fundamental equity research analyst at $50B+ systematic hedge fund. Deep fundamental analysis using traditional and quantitative methods. Hybrid NYC with top-tier compensation and benefits.,Hybrid,Strong fit: fundamental equity research at elite hedge fund. Hybrid NYC is ideal. $150K-$225K meets target. Quantitative element may be less aligned but fundamental research core matches well.,https://www.linkedin.com/jobs/view/4358270270,Verified,"LinkedIn, Company Careers"
NEW,87,Verition Fund Management,Investment Analyst - Consumer/TMT Equity Long/Short,Hedge Fund,"New York, NY",N/A,Analyst on Consumer/TMT Equity Long/Short team at multi-strategy hedge fund. Requires 1-3 years hedge fund experience focused on consumer and internet public equities. Strong TMT sector alignment.,In-Office,"Excellent sector fit: TMT L/S equity at a multi-strat hedge fund in NYC. Salary not listed but likely competitive. 1-3 yrs HF experience specified is junior relative to Aaron's profile, but sector expertise is highly relevant.",https://www.verition.com/open-positions,Unverified,Company Careers
NEW,85,Selby Jennings (Recruiter),Equity Research Analyst - Financials (Capital Markets),Hedge Fund,"New York, NY","$175,000-$500,000",Recruiter-posted role for equity research analyst covering Financials/Capital Markets at a hedge fund or asset manager. Salary range $175K-$500K suggests senior-level buy-side role with significant bonus potential.,In-Office,Strong compensation ($175K-$500K total). ER analyst role at HF level in NYC. Financials sector differs from TMT but research skills transfer. Posted via recruiter so actual employer unknown.,https://www.linkedin.com/jobs/view/4363611844,Verified,LinkedIn
NEW,84,Arootah,Consultant Due Diligence Investment Analyst,Hedge Fund,Remote,$275-$400/hour,Advisory services to hedge fund clients including investment and operational due diligence. Founded by former COO of Blue Ridge Capital ($10B hedge fund). Contract/consulting role.,Remote,Strong fit: hedge fund due diligence consulting leveraging equity research expertise. Excellent hourly rate ($275-$400/hr). Remote flexibility. Contract nature less ideal than full-time.,https://jobs.lever.co/arootah/9013cb10-c8f4-4ac1-91e3-8f9b145058f4,Unverified,Lever
NEW,83,Chicago Trading Company,Equity Research Analyst,Hedge Fund,"Chicago, IL","$200,000-$225,000",Equity research analyst at proprietary trading firm. Conduct fundamental research to support trading strategies. Chicago-based with strong compensation package.,In-Office,Good fit: equity research at trading firm with $200K-$225K salary. Chicago location requires relocation from NYC (lower location score). Fundamental research aligns well with Aaron's skills.,https://www.linkedin.com/jobs/view/4360001234,Verified,LinkedIn
NEW,82,Equi,"Director, Investments - Multi-Strategy Hedge Fund",Hedge Fund,"New York, NY",N/A,Leadership role on investment team at tech-driven multi-manager hedge fund platform. Director-level with upside potential.,N/A,Strong fit: director at multi-strat hedge fund in NYC. Tech-driven platform aligns with software expertise. May be a seniority stretch. Salary unknown but likely competitive.,https://jobs.ashbyhq.com/equi/9db632c2-4e63-423f-a6a5-111debad2610,Unverified,Ashby
NEW,80,BTIG,Associate Director of Equity Research,Investment Bank,"New York, NY",N/A,"Reports to Head of Equity Research, helping develop and implement department best practices. Senior research leadership role at boutique investment bank.",In-Office,Good fit: senior equity research leadership at boutique IB. Similar to current sell-side role but with management scope. NYC location ideal. Salary likely competitive but not listed.,https://boards.greenhouse.io/btig27/jobs/7724790002,Unverified,Greenhouse
NEW,80,Long Ridge Partners (Recruiter),Associate L/S Equity,Hedge Fund,"New York, NY",N/A,"Associate-level L/S equity role at hedge fund (via recruiter). Analyze business models, drive investment opportunities, present actionable trade ideas. 2-5 years IB, ER, or PE experience required.",In-Office,"Good fit: L/S equity at HF in NYC. Aaron's fundamental research skills align well. 2-5 yrs IB/ER requirement is below Aaron's experience level but still relevant. Salary unknown, posted via recruiter.",https://www.linkedin.com/jobs/view/4363170274,Verified,LinkedIn
NEW,79,Point72,"Business Analyst, L/S Equity",Hedge Fund,"Stamford, CT",N/A,Business Analyst supporting long/short equity strategies at Steve Cohen's multi-billion dollar hedge fund.,In-Office,Good fit: L/S equity at elite hedge fund (Point72). Stamford CT commutable from NYC. 'Business Analyst' title may indicate support rather than investment role. Salary likely strong.,https://careers.point72.com/CSJobDetail?jobName=business-analyst-l-s-equity&jobCode=CSS-0013340,Unverified,Company Careers
NEW,78,Seaport Global Holdings,Senior Equity Analyst (Generalist & Special Situations),Investment Bank,"New York, NY",N/A,"Part of Seaport Research Partners sell-side platform providing buy/sell recommendations. Serves 3,000+ institutional accounts.",In-Office,Good fit: senior equity analyst similar to current role. Generalist/special situations differs from TMT but transferable. NYC location ideal.,https://jobs.lever.co/seaportglobal/1056feac-5210-4a44-a7e9-e21b267163a9,Unverified,Lever
NEW,77,Wells Fargo,"Equity Research, Senior Analyst - Mid Cap Banks",Investment Bank,"New York, NY",N/A,Senior equity research analyst covering Mid Cap Banks at major Wall Street bank. Full-time role with 401(k) and benefits.,In-Office,Good fit: senior ER analyst at bulge bracket in NYC. Mid Cap Banks sector differs from software but research methodology transfers. Salary not listed but likely competitive at WF.,https://www.linkedin.com/jobs/view/4371821652,Verified,LinkedIn
NEW,77,Seaport Global Holdings,Research Analyst,Investment Bank,"New York, NY",N/A,"Research analyst performing security-level analysis for Penn Capital portfolios. Requires 5+ years experience, CFA preferred.",In-Office,"Good fit: research analyst with buy-side component (Penn Capital). NYC, CFA preferred matches Aaron's credentials. 5+ year experience aligns.",https://jobs.lever.co/seaportglobal/1c717fba-04bd-441b-9047-9f4433929023,Unverified,Lever
NEW,76,Kennison & Associates,Senior Equity Research Analyst,Asset Management,"Boston, MA","$175,000-$200,000",Senior equity research analyst at Boston-based firm. Hybrid work arrangement with $175K-$200K base plus bonus. Requires deep fundamental analysis skills.,Hybrid,"Good fit: senior ER analyst with $175K-$200K + bonus. Hybrid in Boston (not NYC, lower location score). Research skills transfer well. Strong compensation.",https://www.linkedin.com/jobs/view/4367543210,Verified,LinkedIn
NEW,74,Wells Fargo,"Equity Research, Senior Analyst - Brokers, Asset Managers & Exchanges",Investment Bank,"Boston, MA",N/A,"Senior equity research analyst covering Brokers, Asset Managers & Exchanges at Wells Fargo in Boston. Full-time with 401(k) and benefits.",In-Office,Moderate fit: senior ER at WF in Boston. Financial services coverage differs from TMT. Boston requires relocation. Strong institutional research platform.,https://www.linkedin.com/jobs/view/4371828306,Verified,LinkedIn
NEW,73,RWA.xyz,Senior Research Analyst,Fintech,"New York, NY",N/A,Write research on tokenization for Wall Street readers. Tokenized real-world assets analytics platform targeting institutional investors.,N/A,Moderate fit: research analyst at fintech in NYC writing for Wall Street. Adjacent to equity research but crypto/tokenization focus. Seniority aligns.,https://jobs.ashbyhq.com/RWA.xyz/b3b035a7-3067-4639-998b-863476b22ae3,Unverified,Ashby
NEW,73,Arootah,Consultant - Portfolio Manager (Fractional/Contract),Hedge Fund,Remote,N/A,Experienced PMs consult to hedge fund and family office clients. Requires 10+ years PM experience.,Remote,Moderate fit: HF consulting but requires 10+ years PM experience. Aaron has research not PM background. Remote flexibility positive. Contract nature less ideal.,https://jobs.lever.co/arootah/07f79048-131b-4a9d-94a6-8e6f8bacc1f1,Unverified,Lever
NEW,72,Interplay (Ascend),"Investment Analyst, Ascend",Asset Management,"New York, NY",N/A,"Multi-family office seeking analyst to own financial models, convert unstructured inputs into actionable recommendations.",N/A,Moderate fit: investment analyst at multi-family office in NYC. Financial modeling skills align. More generalist than Aaron's sector expertise.,https://jobs.ashbyhq.com/interplay/49067d40-d1b5-4101-9b9d-37e8216e86f0,Unverified,Ashby
NEW,72,Edward Daniels Group,Portfolio Construction - Hedge Fund,Hedge Fund,"New York, NY",N/A,Quantitative Researcher developing automated trading strategies. Includes systematic fundamental L/S and equity stat arb.,In-Office,Partial fit: HF in NYC but quant-focused. 'Systematic fundamental L/S' has some overlap. Quantitative requirements may not fully align.,https://jobs.lever.co/edgrp/7fedafa0-adc7-4b4f-847f-14510b9a2b2a,Unverified,Lever
NEW,71,Contradict Capital,Investment Analyst,Asset Management,"New York, NY","$100,000-$150,000",Values-driven family office. All aspects of investment lifecycle. 1-3 years experience required.,N/A,Moderate fit: family office in NYC. Salary near but below target ($100K-$150K). 1-3 yrs requirement is junior for Aaron's seniority.,https://jobs.ashbyhq.com/Contradict%20Capital/d95e590b-aba4-4121-bd27-b122f0fba0da,Unverified,Ashby
NEW,70,Titan,Investment Analyst,Asset Management,"New York, NY","$115,000-$189,000",Investment analyst at tech-driven wealth manager backed by a16z and General Catalyst.,N/A,Moderate fit: fintech-adjacent wealth manager in NYC. Salary partially meets target. Tech platform aligns with software expertise but not traditional HF.,https://jobs.ashbyhq.com/titan/77c2dfd9-a46e-4dbd-bc92-e87738c2bf91,Unverified,Ashby
NEW,70,Landing Point,Investment Analyst,Asset Management,"Boston, MA","$200,000",Investment analyst role at Boston-based firm. $200K compensation with strong growth potential.,In-Office,Moderate fit: investment analyst in Boston at $200K. Requires relocation from NYC. Asset management firm aligns with transition goals.,https://www.linkedin.com/jobs/view/4371490467,Verified,LinkedIn
